video_file,feature_path,num_frames,frame_feature_dim,detection_ratio,mean_visibility,motion_mean,motion_p50,motion_p95,motion_max,sentence_id,sentence,category,text_variations
2181B.mp4,./features/pose_data/2181B.npy,246,540,1.0,0.7468562126159668,2.8478128910064697,1.1990127563476562,17.463171005249023,26.492435455322266,2181,Pay a co-pay for ER visits.,Admin and billing,"[""Pay a co-pay for ER visits."", ""You'll need to pay a co-payment for emergency room visits."", ""There's a co-pay required for the ER."", ""For ER visits, a co-pay is due."", ""Co-payment is expected when you visit the emergency room."", ""Pay the ER co-pay.""]"
2182B.mp4,./features/pose_data/2182B.npy,177,540,1.0,0.7331644892692566,2.3268721103668213,1.1028906106948853,14.199142456054688,26.84024429321289,2182,Detailed payment reports available.,Admin and billing,"[""Detailed payment reports available."", ""You can find detailed payment reports here."", ""Detailed payment reports are ready for viewing."", ""Payment reports with full details are accessible."", ""Need a detailed payment report? They're available."", ""Detailed reports on payments can be accessed.""]"
2186B.mp4,./features/pose_data/2186B.npy,169,540,1.0,0.7265207767486572,2.1830804347991943,1.2194030284881592,3.568390369415283,28.011627197265625,2186,Make extra payments if possible.,Admin and billing,"[""Make extra payments if possible."", ""If you can, please make additional payments."", ""Try to pay a little extra if it's feasible."", ""Extra payments are welcome if your budget allows."", ""Pay more than the minimum if you're able."", ""Consider making extra payments when you can.""]"
2190B.mp4,./features/pose_data/2190B.npy,150,540,1.0,0.7295438647270203,2.1309473514556885,1.202755331993103,3.532068014144897,24.82022476196289,2190,Modify payment plans as needed.,Admin and billing,"[""Modify payment plans as needed."", ""Adjust your payment schedule when necessary."", ""Feel free to change your payment arrangements if required."", ""Payment plan updates available upon request."", ""If you need to alter your payment plan, please let us know."", ""Payment plans are flexible and can be changed as needed.""]"
2190E.mp4,./features/pose_data/2190E.npy,109,540,1.0,0.7048649787902832,7.640120506286621,1.9420102834701536,25.92506599426269,32.28507232666016,2190,Modify payment plans as needed.,Admin and billing,"[""Modify payment plans as needed."", ""Adjust your payment schedule when necessary."", ""Feel free to change your payment arrangements if required."", ""Payment plan updates available upon request."", ""If you need to alter your payment plan, please let us know."", ""Payment plans are flexible and can be changed as needed.""]"
2195E.mp4,./features/pose_data/2195E.npy,129,540,1.0,0.7020400166511536,5.059018611907959,1.5351101160049438,21.08859062194824,29.02776527404785,2195,Medical procedures have a coverage limit.,Admin and billing,"[""Medical procedures have a coverage limit."", ""There's a cap on how much medical procedures will cover."", ""Medical treatments come with a coverage ceiling."", ""Coverage for medical procedures has its limits."", ""The amount covered for medical procedures is capped."", ""Be aware that medical procedures have a coverage limit.""]"
2197B.mp4,./features/pose_data/2197B.npy,197,540,1.0,0.7429608106613159,4.027230739593506,1.3594688177108765,21.167938232421875,22.94963264465332,2197,Pay a co-pay for medications.,Admin and billing,"[""Pay a co-pay for medications."", ""You'll need to pay a co-payment for your prescriptions."", ""A co-pay is required for the medications."", ""Please settle the co-pay for the medicine."", ""Make the co-payment for your drugs."", ""There's a co-pay due for the medication.""]"
2203B.mp4,./features/pose_data/2203B.npy,229,540,1.0,0.7277420163154602,1.6667371988296509,1.1165944337844849,3.2264657020568848,22.27482414245605,2203,Do you feel weak or tired all day?,Common symptons,"[""Do you feel weak or tired all day?"", ""Are you feeling weak or tired throughout the day?"", ""Feeling weak or tired all day long?"", ""Do you experience weakness or fatigue all day?"", ""All day, are you feeling weak or tired?"", ""Are you consistently feeling weak or tired?""]"
2203E.mp4,./features/pose_data/2203E.npy,187,540,1.0,0.6931917667388916,4.811532974243164,1.70144522190094,23.5240421295166,27.893688201904297,2203,Do you feel weak or tired all day?,Common symptons,"[""Do you feel weak or tired all day?"", ""Are you feeling weak or tired throughout the day?"", ""Feeling weak or tired all day long?"", ""Do you experience weakness or fatigue all day?"", ""All day, are you feeling weak or tired?"", ""Are you consistently feeling weak or tired?""]"
2206B.mp4,./features/pose_data/2206B.npy,186,540,1.0,0.7167179584503174,4.66839075088501,1.3697209358215332,23.17915153503418,26.47234916687012,2206,Is your skin itchy with rashes or bumps?,Common symptons,"[""Is your skin itchy with rashes or bumps?"", ""Do you have itchy skin with rashes or bumps?"", ""Are you experiencing itchy skin, perhaps with rashes or bumps?"", ""Skin itching, with any rashes or bumps?"", ""Does your skin feel itchy? Do you have any rashes or bumps on it?"", ""Got any itchy skin? Any rashes or bumps?""]"
2211E.mp4,./features/pose_data/2211E.npy,136,540,1.0,0.6845049262046814,5.058197975158691,1.467379093170166,24.869007110595703,36.185279846191406,2211,Have you lost your appetite for food?,Common symptons,"[""Have you lost your appetite for food?"", ""Are you not feeling hungry?"", ""Have you lost your desire to eat?"", ""No appetite?"", ""Do you still have an appetite for food?"", ""Is your appetite gone?""]"
2214B.mp4,./features/pose_data/2214B.npy,152,540,1.0,0.7249287962913513,3.1165595054626465,1.2108904123306274,18.05819129943848,22.7025089263916,2214,Is your urine dark or very little?,Common symptons,"[""Is your urine dark or very little?"", ""Is your urine a dark color or are you producing very little?"", ""Are you noticing dark urine or a reduced output?"", ""Is your urine dark or scanty?"", ""Tell me if your urine is dark or if you're not peeing much."", ""Is your pee dark or are you barely going?""]"
2220E.mp4,./features/pose_data/2220E.npy,223,540,1.0,0.6747806072235107,3.401808738708496,1.175264596939087,17.81181526184082,27.57602310180664,2220,Is harmattan dust making it hard to breathe?,Common symptons,"[""Is harmattan dust making it hard to breathe?"", ""Is the harmattan dust making breathing difficult?"", ""Are you having trouble breathing because of the harmattan dust?"", ""Can't breathe well due to the harmattan dust?"", ""The harmattan dust is making it hard to breathe, isn't it?"", ""Breathing difficulty due to harmattan dust?""]"
2227E.mp4,./features/pose_data/2227E.npy,140,540,1.0,0.6580556631088257,1.7346941232681274,1.3842602968215942,2.760485410690308,23.60567092895508,2227,Is your baby refusing to breastfeed or eat?,Common symptons,"[""Is your baby refusing to breastfeed or eat?"", ""Is your baby having trouble feeding?"", ""Your baby won't breastfeed or eat, is that right?"", ""Is the baby refusing to nurse or take food?"", ""Struggling with breastfeeding or feeding your baby?"", ""Is your infant rejecting the breast or bottle/food?""]"
2228E.mp4,./features/pose_data/2228E.npy,158,540,1.0,0.657023012638092,3.428053379058838,1.419948935508728,18.73625946044922,26.78270721435547,2228,Is your child having frequent diarrhea?,Common symptons,"[""Is your child having frequent diarrhea?"", ""Is your child experiencing frequent diarrhea?"", ""Does your child often have loose stools?"", ""Is your child suffering from recurrent diarrhea?"", ""Frequent diarrhea in your child?"", ""Has your child had diarrhea often lately?""]"
2230B.mp4,./features/pose_data/2230B.npy,153,540,1.0,0.7446067929267883,2.4946181774139404,1.0773288011550903,15.808479309082031,24.91673851013184,2230,Does it hurt when you urinate?,Common symptons,"[""Does it hurt when you urinate?"", ""Do you experience pain during urination?"", ""Is urination painful for you?"", ""Does it sting when you pee?"", ""Are you in pain when you go to the bathroom to urinate?"", ""Any discomfort while urinating?""]"
2230E.mp4,./features/pose_data/2230E.npy,171,540,1.0,0.7146843075752258,5.887166500091553,1.6072219610214231,24.992794036865234,32.531524658203125,2230,Does it hurt when you urinate?,Common symptons,"[""Does it hurt when you urinate?"", ""Do you experience pain during urination?"", ""Is urination painful for you?"", ""Does it sting when you pee?"", ""Are you in pain when you go to the bathroom to urinate?"", ""Any discomfort while urinating?""]"
2234E.mp4,./features/pose_data/2234E.npy,334,540,1.0,0.7039839625358582,3.6336493492126474,1.3191347122192385,18.89858055114746,27.570392608642575,2234,"Do you have malaria symptoms (fever, chills, sweats)?",Common symptons,"[""Do you have malaria symptoms (fever, chills, sweats)?"", ""Are you experiencing symptoms of malaria, such as fever, chills, or sweats?"", ""Have you had any malaria-like symptoms, like a fever, chills, or sweats?"", ""Do you have a fever, chills, or sweats? Those can be signs of malaria."", ""Any fever, chills, or sweats? It might be malaria."", ""Could you be experiencing malaria symptoms? I'm asking about things like fever, chills, and sweating.""]"
2234B.mp4,./features/pose_data/2234B.npy,282,540,1.0,0.734459638595581,1.932833194732666,1.2408205270767212,3.613237142562866,27.218080520629883,2234,"Do you have malaria symptoms (fever, chills, sweats)?",Common symptons,"[""Do you have malaria symptoms (fever, chills, sweats)?"", ""Are you experiencing symptoms of malaria, such as fever, chills, or sweats?"", ""Have you had any malaria-like symptoms, like a fever, chills, or sweats?"", ""Do you have a fever, chills, or sweats? Those can be signs of malaria."", ""Any fever, chills, or sweats? It might be malaria."", ""Could you be experiencing malaria symptoms? I'm asking about things like fever, chills, and sweating.""]"
2235B.mp4,./features/pose_data/2235B.npy,345,540,1.0,0.7319191694259644,2.0005578994750977,1.173393487930298,3.980838060379028,25.552743911743164,2235,Is your face or body swollen (like kidney issues)?,Common symptons,"[""Is your face or body swollen (like kidney issues)?"", ""Are you experiencing swelling in your face or body, possibly related to kidney problems?"", ""Got any puffiness in your face or body? Could be kidney-related."", ""Is your face or body swollen? (Thinking kidney issues.)"", ""Have you noticed swelling, particularly around your face or body, which might indicate kidney issues?"", ""Face or body swelling? Kidney problems?""]"
2237B.mp4,./features/pose_data/2237B.npy,270,540,1.0,0.7236050963401794,1.9984031915664675,1.11633563041687,3.797616481781006,25.71293067932129,2237,"Do you feel sad, worried, or scared often?",Common symptons,"[""Do you feel sad, worried, or scared often?"", ""Are you frequently experiencing sadness, worry, or fear?"", ""How often do you feel sad, worried, or scared?"", ""Do you often feel down, anxious, or frightened?"", ""Feeling sad, worried, or scared \u2013 does that happen often for you?"", ""You get sad, worried, or scared a lot?""]"
2239B.mp4,./features/pose_data/2239B.npy,239,540,1.0,0.7349050641059875,2.350980758666992,1.0475735664367676,16.46589469909668,25.573047637939453,2239,Do you have bad dreams or scary thoughts?,Common symptons,"[""Do you have bad dreams or scary thoughts?"", ""Do you experience nightmares or have frightening thoughts?"", ""Are you having bad dreams or scary thoughts?"", ""Do nightmares or scary thoughts bother you?"", ""Having bad dreams or scary thoughts?"", ""Do you get nightmares or have unsettling thoughts?""]"
2243E.mp4,./features/pose_data/2243E.npy,136,540,1.0,0.7187183499336243,5.467208385467529,1.581725835800171,20.708887100219727,27.230243682861328,2243,Did herbal remedies make you feel worse?,Common symptons,"[""Did herbal remedies make you feel worse?"", ""Did the herbal remedies have a negative effect on you?"", ""Did you feel worse after taking the herbal remedies?"", ""Were the herbal remedies making you feel worse?"", ""How did the herbal remedies affect you? Did you feel worse?"", ""Did the herbs make you feel worse?""]"
2253E.mp4,./features/pose_data/2253E.npy,278,540,1.0,0.6745844483375549,1.8867027759552,0.8726729154586792,2.8238651752471924,27.6404972076416,2253,Are your nails discolored or brittle?,Common symptons,"[""Are your nails discolored or brittle?"", ""Are your nails discolored or do they seem brittle?"", ""Do your nails look discolored or brittle?"", ""I notice your nails appear discolored or brittle. Is that correct?"", ""Are your nails discolored and brittle?"", ""What's going on with your nails? Are they discolored or brittle?""]"
2254E.mp4,./features/pose_data/2254E.npy,194,540,1.0,0.7049166560173035,5.454725742340088,1.6308917999267578,24.625131607055664,30.9307861328125,2254,Do you feel pain when walking or standing?,Common symptons,"[""Do you feel pain when walking or standing?"", ""Does it hurt when you walk or stand?"", ""Are you experiencing pain while walking or standing?"", ""Do you feel any pain when you're up and about?"", ""Is there discomfort when you walk or stand?"", ""Pain walking or standing?""]"
2255E.mp4,./features/pose_data/2255E.npy,222,540,1.0,0.688690185546875,2.7470948696136475,1.0986461639404297,20.376296997070312,27.98953628540039,2255,Is your vision blurry or eyes sensitive to light?,Common symptons,"[""Is your vision blurry or eyes sensitive to light?"", ""Are your eyes experiencing blurriness or light sensitivity?"", ""Do you have blurry vision or are your eyes sensitive to light?"", ""Is your vision unclear, or are your eyes bothered by light?"", ""Blurry vision or light sensitivity in your eyes?"", ""Are you seeing double or finding light painful for your eyes?""]"
2256B.mp4,./features/pose_data/2256B.npy,198,540,1.0,0.744256854057312,1.688640832901001,0.8855640292167664,3.683680772781372,25.649097442626957,2256,Are you losing hair in patches?,Common symptons,"[""Are you losing hair in patches?"", ""Are you experiencing hair loss in specific areas?"", ""Is your hair falling out in clumps?"", ""Are you noticing bald spots?"", ""Have you noticed any patches of hair thinning or falling out?"", ""Losing hair in spots?""]"
2257B.mp4,./features/pose_data/2257B.npy,202,540,1.0,0.7223491668701172,3.270281314849853,1.2385094165802002,19.68829345703125,24.95670890808105,2257,Do you have white patches on your skin?,Common symptons,"[""Do you have white patches on your skin?"", ""Are there any white spots on your skin?"", ""Do you notice any white areas on your skin?"", ""Could you tell me if you see any white patches on your skin?"", ""White patches on your skin \u2013 do you have any?"", ""Have you observed any discoloration, specifically white patches, on your skin?""]"
2259B.mp4,./features/pose_data/2259B.npy,146,540,1.0,0.7356473207473755,1.2188776731491089,0.8248146772384644,3.2094595432281494,20.417665481567383,2259,Do you have a bitter taste in your mouth?,Common symptons,"[""Do you have a bitter taste in your mouth?"", ""Is your mouth tasting bitter?"", ""Do you have a bitter taste in your mouth right now?"", ""Is there a bitter sensation in your mouth?"", ""Got a bitter taste in your mouth?"", ""Are you experiencing a bitter taste in your mouth?""]"
2266B.mp4,./features/pose_data/2266B.npy,136,540,1.0,0.7256494760513306,1.5611664056777954,1.0269259214401243,3.995897054672241,24.15606117248535,2266,Do you feel like you’re spinning (vertigo)?,Common symptons,"[""Do you feel like you\u2019re spinning (vertigo)?"", ""Are you experiencing dizziness?"", ""Feeling dizzy?"", ""Do you feel a spinning sensation?"", ""Are you feeling like the world is spinning around you?"", ""Got that dizzy feeling?""]"
2274E.mp4,./features/pose_data/2274E.npy,223,540,1.0,0.7309685945510864,2.371527910232544,1.03765869140625,15.956600189208984,26.91389274597168,2274,Do you have mouth ulcers or sores?,Common symptons,"[""Do you have mouth ulcers or sores?"", ""Are you experiencing any mouth sores or ulcers?"", ""Got any mouth ulcers or sores?"", ""Do you have any sores in your mouth, like ulcers?"", ""Any mouth ulcers or sores to report?"", ""Are your mouth ulcers or sores bothering you?""]"
2276B.mp4,./features/pose_data/2276B.npy,160,540,1.0,0.7498008608818054,1.943647384643555,1.1095943450927734,2.79047966003418,25.97627258300781,2276,Are you shivering even in warm weather?,Common symptons,"[""Are you shivering even in warm weather?"", ""Are you feeling cold even though it's warm outside?"", ""Why are you shivering if it's not cold?"", ""It's warm out, but you're still shivering. Is everything okay?"", ""Are you cold even in this warm weather?"", ""You're shivering, but it's warm. What's up?""]"
2279E.mp4,./features/pose_data/2279E.npy,149,540,1.0,0.7449416518211365,2.658673048019409,1.0728768110275269,16.794879913330078,22.46486473083496,2279,Do you feel a lump in your throat?,Common symptons,"[""Do you feel a lump in your throat?"", ""Do you have a lump in your throat?"", ""Are you feeling something in your throat?"", ""Do you feel a lump?"", ""Is there a lump in your throat?"", ""Do you notice any throat discomfort?""]"
2282E.mp4,./features/pose_data/2282E.npy,143,540,1.0,0.6786910891532898,2.347630739212036,1.033226728439331,16.808094024658203,23.421937942504883,2282,Are your legs cramping at night?,Common symptons,"[""Are your legs cramping at night?"", ""Do you get leg cramps during the night?"", ""Experiencing leg cramps at night?"", ""Are your legs experiencing nocturnal cramping?"", ""Do your legs cramp up when you're sleeping?"", ""Nighttime leg cramps \u2013 are they happening to you?""]"
2289E.mp4,./features/pose_data/2289E.npy,245,540,1.0,0.7443522214889526,1.7781051397323608,1.0187221765518188,2.9772753715515137,32.08267974853516,2289,Do you have bruises without injury?,Common symptons,"[""Do you have bruises without injury?"", ""Are you experiencing bruising without any apparent injury?"", ""Got any bruises but don't remember getting hurt?"", ""Any unexplained bruising?"", ""Do you have bruises, but no recollection of an injury?"", ""Are there any bruises on you that you can't explain by an injury?""]"
2290E.mp4,./features/pose_data/2290E.npy,241,540,1.0,0.6790192723274231,2.7875523567199707,1.1454026699066162,17.66827392578125,26.28077888488769,2290,Are you struggling to bend your knees or elbows?,Common symptons,"[""Are you struggling to bend your knees or elbows?"", ""Do you have difficulty bending your knees or elbows?"", ""Is it hard for you to bend your knees or elbows?"", ""Are your knees or elbows giving you trouble when you try to bend them?"", ""Are you experiencing pain or stiffness when bending your knees or elbows?"", ""Knee or elbow bending difficulty?""]"
2293E.mp4,./features/pose_data/2293E.npy,164,540,1.0,0.7248286008834839,4.229242324829102,1.2196847200393677,19.68922233581543,26.378999710083008,2293,Do you feel like your throat is closing up?,Common symptons,"[""Do you feel like your throat is closing up?"", ""Are you experiencing a sensation of your throat closing?"", ""Does it feel like your throat is tightening up?"", ""Is your throat feeling constricted?"", ""Your throat closing up, do you feel that?"", ""How's your throat feeling? Is it closing?""]"
2296B.mp4,./features/pose_data/2296B.npy,202,540,1.0,0.7491786479949951,1.1169166564941406,0.8379549980163574,1.7163602113723757,21.783700942993164,2296,Are your legs heavy and hard to move?,Common symptons,"[""Are your legs heavy and hard to move?"", ""Are your legs feeling heavy and difficult to move?"", ""Do your legs feel stiff and hard to get going?"", ""Experiencing leg heaviness and immobility?"", ""Having trouble moving your legs due to their heaviness?"", ""Are your legs heavy, making them hard to move?""]"
2303B.mp4,./features/pose_data/2303B.npy,119,540,1.0,0.6428402066230774,1.334862232208252,0.8313742876052856,2.8264667987823486,28.356834411621094,2303,Do you have a clicking sound in your jaw?,Common symptons,"[""Do you have a clicking sound in your jaw?"", ""Does your jaw make a clicking noise?"", ""Do you hear a click when you move your jaw?"", ""Is there any clicking sensation in your jaw?"", ""Does your jaw click?"", ""Do you experience any jaw clicking?""]"
2304B.mp4,./features/pose_data/2304B.npy,129,540,1.0,0.6932395696640015,2.262760162353516,0.9037278294563292,3.582702159881592,39.956764221191406,2304,Are your shoulders stiff or painful?,Common symptons,"[""Are your shoulders stiff or painful?"", ""Are your shoulders feeling stiff or hurting?"", ""Do your shoulders hurt or feel stiff?"", ""Is there stiffness or pain in your shoulders?"", ""Are your shoulders stiff and/or sore?"", ""Shoulder stiffness or pain?""]"
2307E.mp4,./features/pose_data/2307E.npy,358,540,1.0,0.7358723878860474,2.7755887508392334,1.1286933422088623,19.8382568359375,37.61810302734375,2307,"Do you have a rash in skin folds (armpits, groin)?",Common symptons,"[""Do you have a rash in skin folds (armpits, groin)?"", ""Are you experiencing a rash in areas like your armpits or groin?"", ""Do you have any skin irritation in your folds, such as your armpits or groin?"", ""Rash in skin folds (armpits, groin)?"", ""Have you noticed any rash in your body folds, like under your arms or in your groin area?"", ""Is there a rash developing in your skin folds, for instance, in your armpits or groin?""]"
2307B.mp4,./features/pose_data/2307B.npy,192,540,1.0,0.7009186744689941,3.466679573059082,1.2074285745620728,26.642162322998047,31.29557228088379,2307,"Do you have a rash in skin folds (armpits, groin)?",Common symptons,"[""Do you have a rash in skin folds (armpits, groin)?"", ""Are you experiencing a rash in areas like your armpits or groin?"", ""Do you have any skin irritation in your folds, such as your armpits or groin?"", ""Rash in skin folds (armpits, groin)?"", ""Have you noticed any rash in your body folds, like under your arms or in your groin area?"", ""Is there a rash developing in your skin folds, for instance, in your armpits or groin?""]"
2310E.mp4,./features/pose_data/2310E.npy,266,540,1.0,0.7450282573699951,5.996195793151856,1.4930860996246338,23.839508056640625,37.64895248413086,2310,Malaria requires antimalarial medication—start treatment today.,Common symptons,"[""Malaria requires antimalarial medication\u2014start treatment today."", ""If you have malaria, you need antimalarial medication; begin treatment immediately."", ""Treatment for malaria with antimalarial drugs should commence today."", ""Malaria treatment: antimalarial medication, start now."", ""Begin taking antimalarial medication for your malaria today."", ""It's crucial to start antimalarial medication for malaria today.""]"
2310B.mp4,./features/pose_data/2310B.npy,351,540,1.0,0.7391997575759888,0.976629376411438,0.8979824781417847,1.7778902053833008,3.1364495754241943,2310,Malaria requires antimalarial medication—start treatment today.,Common symptons,"[""Malaria requires antimalarial medication\u2014start treatment today."", ""If you have malaria, you need antimalarial medication; begin treatment immediately."", ""Treatment for malaria with antimalarial drugs should commence today."", ""Malaria treatment: antimalarial medication, start now."", ""Begin taking antimalarial medication for your malaria today."", ""It's crucial to start antimalarial medication for malaria today.""]"
2316E.mp4,./features/pose_data/2316E.npy,174,540,1.0,0.7062375545501709,3.8346571922302246,1.45727276802063,19.84659576416016,29.428028106689453,2316,Your child’s next vaccination is due in two weeks.,Common symptons,"[""Your child\u2019s next vaccination is due in two weeks."", ""Your child is due for their next vaccination in a fortnight."", ""The next shot for your child is scheduled in two weeks."", ""Your kid's next vaccine is coming up in two weeks."", ""In two weeks, your child will need their next vaccination."", ""Two weeks from now, your child's vaccination is due.""]"
2317E.mp4,./features/pose_data/2317E.npy,176,540,1.0,0.7342555522918701,4.152151584625244,1.565178632736206,25.2979736328125,42.091434478759766,2317,Boil water before drinking to prevent stomach illnesses.,Common symptons,"[""Boil water before drinking to prevent stomach illnesses."", ""Make sure to boil your water before drinking it, as this helps prevent stomach illnesses."", ""Boiling water is necessary for safe drinking and will guard against stomach ailments."", ""Always boil water before consumption to avoid getting sick to your stomach."", ""For safe drinking, boil the water first. This prevents stomach illnesses."", ""To prevent stomach problems, boil water prior to drinking.""]"
2319B.mp4,./features/pose_data/2319B.npy,190,540,1.0,0.7418416142463684,3.071568489074707,1.2838497161865234,18.549545288085938,21.62008285522461,2319,Return to the clinic in 10 days for a checkup.,Common symptons,"[""Return to the clinic in 10 days for a checkup."", ""Come back to the clinic in ten days for a follow-up appointment."", ""You need to return for a checkup in 10 days."", ""Your next checkup at the clinic is in 10 days."", ""Please schedule a return visit to the clinic in 10 days for your checkup."", ""Ten days from now, please come back to the clinic for your checkup.""]"
