video_file,feature_path,num_frames,frame_feature_dim,detection_ratio,mean_visibility,motion_mean,motion_p50,motion_p95,motion_max,sentence_id,sentence,category,text_variations
3323C.mp4,./features/pose_data/3323C.npy,206,540,1.0,0.6672977209091187,2.452565670013428,1.0051374435424805,13.727127075195312,15.9347505569458,3323,Practice good hygiene to prevent infection.,Infectious disease and prevention,"[""Practice good hygiene to prevent infection."", ""Maintain good hygiene to avoid getting sick."", ""Keep up with your hygiene habits to prevent infections."", ""Good hygiene is key to preventing infections."", ""To stop infections, practice good hygiene."", ""Practice excellent hygiene for infection prevention.""]"
3324E.mp4,./features/pose_data/3324E.npy,220,540,1.0,0.7145482897758484,5.586541175842285,1.5519176721572876,19.19049835205078,23.27423667907715,3324,Visit the hospital if you have symptoms of an infectious disease.,Infectious disease and prevention,"[""Visit the hospital if you have symptoms of an infectious disease."", ""If you're showing symptoms of a contagious illness, go to the hospital."", ""Seek medical attention at the hospital if you suspect an infectious disease."", ""Have symptoms of an infectious disease? Head to the hospital."", ""It's advisable to visit the hospital if you exhibit signs of an infectious disease."", ""If you have the signs of a communicable illness, you should go to the hospital.""]"
3327E.mp4,./features/pose_data/3327E.npy,265,540,1.0,0.693835437297821,5.90437126159668,1.429540753364563,20.619096755981445,25.72215843200684,3327,Do not share personal items like towels or toothbrushes.,Infectious disease and prevention,"[""Do not share personal items like towels or toothbrushes."", ""Please refrain from sharing personal items such as towels or toothbrushes."", ""Keep your personal belongings, like towels and toothbrushes, to yourself."", ""No sharing personal items, including towels and toothbrushes."", ""It's important not to share personal items like towels and toothbrushes."", ""Avoid sharing personal items such as towels or toothbrushes.""]"
3335C.mp4,./features/pose_data/3335C.npy,208,540,1.0,0.7260691523551941,2.571324825286865,1.268816590309143,13.083218574523926,20.911474227905277,3335,Eat a balanced diet to strengthen your immune system.,Infectious disease and prevention,"[""Eat a balanced diet to strengthen your immune system."", ""To boost your immunity, eat a well-rounded diet."", ""A balanced diet is key for a strong immune system."", ""Strengthen your immune system by eating healthily."", ""Eating a balanced diet helps build up your immunity."", ""For a robust immune system, focus on a balanced diet.""]"
3336E.mp4,./features/pose_data/3336E.npy,207,540,1.0,0.718292772769928,5.459430694580078,1.7401007413864136,20.462331771850582,25.3718204498291,3336,Avoid touching your face with unwashed hands.,Infectious disease and prevention,"[""Avoid touching your face with unwashed hands."", ""Please refrain from touching your face if your hands aren't clean."", ""Don't touch your face with dirty hands."", ""Keep unwashed hands away from your face."", ""It's important to avoid facial contact with unwashed hands."", ""Hands that are not clean should not touch your face.""]"
3336C.mp4,./features/pose_data/3336C.npy,176,540,1.0,0.6787118911743164,1.8449714183807373,1.1662535667419434,4.750528335571289,20.84537696838379,3336,Avoid touching your face with unwashed hands.,Infectious disease and prevention,"[""Avoid touching your face with unwashed hands."", ""Please refrain from touching your face if your hands aren't clean."", ""Don't touch your face with dirty hands."", ""Keep unwashed hands away from your face."", ""It's important to avoid facial contact with unwashed hands."", ""Hands that are not clean should not touch your face.""]"
3337E.mp4,./features/pose_data/3337E.npy,135,540,1.0,0.6990811228752136,6.93980073928833,1.5304405689239502,22.02172470092773,28.76006126403809,3337,"If you have a fever, see a doctor immediately.",Infectious disease and prevention,"[""If you have a fever, see a doctor immediately."", ""Seek medical attention right away if you have a fever."", ""Should you develop a fever, please consult a doctor without delay."", ""Got a fever? See a doctor now."", ""If fever is present, prompt medical consultation is advised."", ""It's important to see a doctor immediately if you're running a fever.""]"
3339C.mp4,./features/pose_data/3339C.npy,238,540,1.0,0.7038177847862244,2.516165018081665,1.184028387069702,14.600149154663086,23.242834091186523,3339,Diarrhea can be a sign of an infection—drink clean water.,Infectious disease and prevention,"[""Diarrhea can be a sign of an infection\u2014drink clean water."", ""If you have diarrhea, it might mean you have an infection, so be sure to drink clean water."", ""Diarrhea could indicate an infection. Drink purified water."", ""An infection can cause diarrhea. Drink safe water."", ""Clean water is important to drink, especially if diarrhea is a symptom of an infection."", ""Diarrhea may signal an infection; ensure you drink clean water.""]"
3340E.mp4,./features/pose_data/3340E.npy,223,540,1.0,0.6662782430648804,6.895956516265869,1.6400874853134155,19.622114181518555,26.354677200317383,3340,Wash your hands frequently to remove germs.,Infectious disease and prevention,"[""Wash your hands frequently to remove germs."", ""Please wash your hands often to get rid of germs."", ""Wash hands often. This helps remove germs."", ""Frequent handwashing is important for germ removal."", ""To keep germs away, wash your hands regularly."", ""Wash your hands a lot to eliminate germs.""]"
3340C.mp4,./features/pose_data/3340C.npy,182,540,1.0,0.653041422367096,2.283210039138794,1.1203222274780271,14.215993881225586,16.379228591918945,3340,Wash your hands frequently to remove germs.,Infectious disease and prevention,"[""Wash your hands frequently to remove germs."", ""Please wash your hands often to get rid of germs."", ""Wash hands often. This helps remove germs."", ""Frequent handwashing is important for germ removal."", ""To keep germs away, wash your hands regularly."", ""Wash your hands a lot to eliminate germs.""]"
3345C.mp4,./features/pose_data/3345C.npy,182,540,1.0,0.7203750610351562,3.2449753284454346,1.3061641454696655,15.317291259765623,21.001420974731445,3345,Stay away from crowded places if you are sick.,Infectious disease and prevention,"[""Stay away from crowded places if you are sick."", ""If you're unwell, it's best to avoid crowded areas."", ""Please keep your distance from busy spots when you're sick."", ""Sick people should steer clear of crowds."", ""To prevent spreading illness, avoid places with many people if you are feeling unwell."", ""Don't go to crowded places if you're sick.""]"
3350E.mp4,./features/pose_data/3350E.npy,295,540,1.0,0.7173260450363159,6.63532304763794,1.51220965385437,24.030908584594727,30.705787658691406,3350,Cook seafood properly to avoid foodborne illnesses.,Infectious disease and prevention,"[""Cook seafood properly to avoid foodborne illnesses."", ""Be sure to cook seafood thoroughly to prevent foodborne illnesses."", ""Cook your seafood right to keep from getting sick from it."", ""Proper seafood cooking prevents foodborne illness."", ""To avoid foodborne illnesses, cook seafood correctly."", ""Make sure seafood is cooked well to avoid food poisoning.""]"
3354E.mp4,./features/pose_data/3354E.npy,180,540,1.0,0.7209936380386353,5.713777542114258,1.5965291261672974,21.271148681640625,24.574949264526367,3354,Cover food properly to keep flies away.,Infectious disease and prevention,"[""Cover food properly to keep flies away."", ""Make sure to cover your food well to prevent flies from getting to it."", ""Properly cover food to deter flies."", ""Keep flies off your food by covering it adequately."", ""Ensure food is covered to keep it fly-free."", ""It's important to cover food to stop flies from bothering it.""]"
3355E.mp4,./features/pose_data/3355E.npy,347,540,1.0,0.7180680632591248,4.260428428649902,1.233744740486145,21.05054473876953,31.700366973876957,3355,Do not share razors or needles to avoid infections.,Infectious disease and prevention,"[""Do not share razors or needles to avoid infections."", ""Please don't share razors or needles; it can lead to infections."", ""Avoid sharing razors and needles to prevent infections."", ""Sharing razors or needles can cause infections, so please don't."", ""To prevent the spread of infections, refrain from sharing razors or needles."", ""Don't share razors or needles. It's to avoid getting infections.""]"
3356C.mp4,./features/pose_data/3356C.npy,196,540,1.0,0.6855029463768005,1.7271859645843506,0.9746571183204652,4.957005500793457,23.116941452026367,3356,Practice safe food handling to prevent stomach infections.,Infectious disease and prevention,"[""Practice safe food handling to prevent stomach infections."", ""Handle food carefully to avoid getting sick."", ""To prevent stomach bugs, always practice safe food handling."", ""Keep your stomach healthy by handling food safely."", ""Safe food preparation is key to preventing gastrointestinal illness."", ""Don't get a stomach infection; handle your food properly.""]"
3359E.mp4,./features/pose_data/3359E.npy,150,540,1.0,0.7074867486953735,8.484293937683105,2.01196837425232,24.38657569885254,30.51294708251953,3359,Seek early treatment if you notice signs of infection.,Infectious disease and prevention,"[""Seek early treatment if you notice signs of infection."", ""If you see signs of infection, get medical help right away."", ""Early treatment is recommended if you detect signs of infection."", ""Notice any signs of infection? Seek prompt medical attention."", ""Should you observe symptoms of infection, it's best to get treatment soon."", ""Get treatment early if you spot infection signs.""]"
3365E.mp4,./features/pose_data/3365E.npy,213,540,1.0,0.6897875070571899,6.863519668579102,2.209742307662964,21.870685577392575,28.983837127685547,3365,Prevent malaria by sleeping under a treated mosquito net.,Infectious disease and prevention,"[""Prevent malaria by sleeping under a treated mosquito net."", ""To avoid malaria, sleep beneath a net treated for mosquitoes."", ""Sleep under a mosquito net that's been treated to prevent malaria."", ""Use a treated mosquito net while sleeping to keep malaria away."", ""Malaria prevention: sleep under a treated net."", ""Protect yourself from malaria by sleeping with a treated mosquito net.""]"
3366E.mp4,./features/pose_data/3366E.npy,244,540,1.0,0.7106348276138306,7.897816181182861,1.8833781480789185,24.10516166687012,32.47150802612305,3366,Public toilets should be kept clean to prevent disease outbreaks.,Infectious disease and prevention,"[""Public toilets should be kept clean to prevent disease outbreaks."", ""Please help keep the public restrooms clean to avoid spreading illnesses."", ""Maintaining cleanliness in public toilets is crucial for preventing disease outbreaks."", ""Keep public toilets clean to stop the spread of disease."", ""To prevent disease, it's important that public restrooms remain clean."", ""Clean public toilets are necessary to avoid health outbreaks.""]"
3367E.mp4,./features/pose_data/3367E.npy,272,540,1.0,0.6726215481758118,4.932110786437988,1.1902306079864502,20.37653541564941,29.920974731445312,3367,Proper handwashing takes at least 20 seconds.,Infectious disease and prevention,"[""Proper handwashing takes at least 20 seconds."", ""Washing your hands correctly requires a minimum of 20 seconds."", ""Make sure to wash your hands for a full 20 seconds."", ""Proper handwashing: 20 seconds minimum."", ""To wash your hands effectively, aim for at least 20 seconds."", ""It's important to spend at least 20 seconds washing your hands properly.""]"
3367C.mp4,./features/pose_data/3367C.npy,163,540,1.0,0.6571475267410278,1.5435051918029783,0.9672915935516356,2.455852508544922,14.664750099182127,3367,Proper handwashing takes at least 20 seconds.,Infectious disease and prevention,"[""Proper handwashing takes at least 20 seconds."", ""Washing your hands correctly requires a minimum of 20 seconds."", ""Make sure to wash your hands for a full 20 seconds."", ""Proper handwashing: 20 seconds minimum."", ""To wash your hands effectively, aim for at least 20 seconds."", ""It's important to spend at least 20 seconds washing your hands properly.""]"
3369E.mp4,./features/pose_data/3369E.npy,190,540,1.0,0.7065328359603882,5.684383869171143,1.3554465770721436,20.398754119873047,27.35833549499512,3369,Wear protective clothing when dealing with infectious patients.,Infectious disease and prevention,"[""Wear protective clothing when dealing with infectious patients."", ""When you're around patients with infectious diseases, make sure you wear protective clothing."", ""Protective clothing is essential when you're caring for patients who are infectious."", ""For infectious patients, always wear protective gear."", ""It's important to wear protective clothing if you're interacting with patients who have infectious conditions."", ""Put on protective clothing when attending to infectious patients.""]"
3373C.mp4,./features/pose_data/3373C.npy,125,540,1.0,0.7002268433570862,2.5849108695983887,1.3341493606567385,14.323219299316406,18.3631591796875,3373,"Take your full course of medicine, even if you feel better.",Infectious disease and prevention,"[""Take your full course of medicine, even if you feel better."", ""Complete your entire course of medication, even if you start feeling well."", ""Finish all of your medicine, regardless of how you feel."", ""It's important to take your full prescription, even if symptoms improve."", ""Keep taking your medicine until it's all gone, even if you feel better."", ""You must finish the whole course of treatment, even if you're feeling better.""]"
3376E.mp4,./features/pose_data/3376E.npy,164,540,1.0,0.6907206177711487,6.261398792266846,1.890172004699707,21.842702865600582,30.859872817993164,3376,Rest is important for the body to fight infections.,Infectious disease and prevention,"[""Rest is important for the body to fight infections."", ""Rest is crucial for your body's ability to combat infections."", ""Getting enough rest helps your body fight off sickness."", ""Your body needs rest to effectively fight infections."", ""To fight infections, rest is essential for the body."", ""Resting is important for the body's defense against infections.""]"
3376C.mp4,./features/pose_data/3376C.npy,173,540,1.0,0.6893377304077148,1.7494688034057615,1.2123881578445437,3.654252529144287,14.4976167678833,3376,Rest is important for the body to fight infections.,Infectious disease and prevention,"[""Rest is important for the body to fight infections."", ""Rest is crucial for your body's ability to combat infections."", ""Getting enough rest helps your body fight off sickness."", ""Your body needs rest to effectively fight infections."", ""To fight infections, rest is essential for the body."", ""Resting is important for the body's defense against infections.""]"
3377C.mp4,./features/pose_data/3377C.npy,230,540,1.0,0.7159155011177063,2.651099681854248,1.0807470083236694,16.54785919189453,21.165748596191406,3377,Disinfect mobile phones and frequently touched objects regularly.,Infectious disease and prevention,"[""Disinfect mobile phones and frequently touched objects regularly."", ""Regularly disinfect your mobile phones and items you touch often."", ""Make sure to disinfect your phone and frequently touched objects on a regular basis."", ""Clean your phone and high-touch surfaces often."", ""It's important to regularly sanitize mobile phones and objects that are frequently handled."", ""Disinfect phones and frequently used items regularly.""]"
3377E.mp4,./features/pose_data/3377E.npy,194,540,1.0,0.7128010988235474,4.148097515106201,1.3450369834899902,20.53322029113769,23.1804256439209,3377,Disinfect mobile phones and frequently touched objects regularly.,Infectious disease and prevention,"[""Disinfect mobile phones and frequently touched objects regularly."", ""Regularly disinfect your mobile phones and items you touch often."", ""Make sure to disinfect your phone and frequently touched objects on a regular basis."", ""Clean your phone and high-touch surfaces often."", ""It's important to regularly sanitize mobile phones and objects that are frequently handled."", ""Disinfect phones and frequently used items regularly.""]"
3379C.mp4,./features/pose_data/3379C.npy,221,540,1.0,0.6939452290534973,2.05515193939209,1.09600830078125,12.221394538879396,16.09724998474121,3379,Good nutrition helps the body fight off infections naturally.,Infectious disease and prevention,"[""Good nutrition helps the body fight off infections naturally."", ""Eating well supports your body's natural defenses against illness."", ""Proper nutrition boosts your body's ability to combat infections on its own."", ""Good food helps your body fight sickness, naturally."", ""Your body can naturally fend off infections when you eat nutritiously."", ""The body's natural ability to fight infections is enhanced by good nutrition.""]"
3380E.mp4,./features/pose_data/3380E.npy,272,540,1.0,0.7372444272041321,4.765981197357178,1.332494616508484,20.50074005126953,27.202322006225582,3380,Keep windows open for fresh air and proper ventilation.,Infectious disease and prevention,"[""Keep windows open for fresh air and proper ventilation."", ""Please leave the windows open for fresh air and good ventilation."", ""Keep the windows ajar for fresh air and to help things ventilate."", ""For fresh air and ventilation, keep the windows open."", ""Let's keep the windows open to get some fresh air and air the place out."", ""Ensure windows are open to allow for fresh air and proper ventilation.""]"
3381E.mp4,./features/pose_data/3381E.npy,215,540,1.0,0.7425200939178467,3.5714757442474365,1.3509029150009155,21.31461524963379,28.80884552001953,3381,Avoid handling food when you have a cold or flu.,Infectious disease and prevention,"[""Avoid handling food when you have a cold or flu."", ""Don't handle food if you're sick with a cold or flu."", ""Please refrain from preparing or serving food when you have a cold or the flu."", ""If you're feeling unwell with a cold or flu, it's best to avoid touching food."", ""Avoid contact with food when you have cold or flu symptoms."", ""When you have a cold or flu, do not handle food.""]"
3397E.mp4,./features/pose_data/3397E.npy,148,540,1.0,0.7178294062614441,6.210429191589356,1.5665744543075562,22.362668991088867,28.25666618347168,3397,Sanitize children’s toys regularly to prevent illness.,Infectious disease and prevention,"[""Sanitize children\u2019s toys regularly to prevent illness."", ""Regularly sanitize children's toys to keep them from getting sick."", ""It's important to clean children's toys often to avoid illnesses."", ""Sanitize toy products for kids on a regular basis to prevent sickness."", ""To stop kids from catching illnesses, clean their toys frequently."", ""Frequent sanitization of children's toys helps prevent illness.""]"
3398C.mp4,./features/pose_data/3398C.npy,264,540,1.0,0.721932590007782,1.99043083190918,1.0433762073516846,10.988494873046877,20.90385055541992,3398,Keep garbage bins closed to stop pests from spreading disease.,Infectious disease and prevention,"[""Keep garbage bins closed to stop pests from spreading disease."", ""Please keep your garbage bins shut to prevent pests from spreading illness."", ""Close garbage bins tightly to avoid pest-borne diseases."", ""To prevent disease spread by pests, ensure garbage bins are kept closed."", ""Keep those bins shut! Pests can spread diseases."", ""Secure your garbage bins to keep pests out and prevent the spread of disease.""]"
3400C.mp4,./features/pose_data/3400C.npy,258,540,1.0,0.7264024615287781,1.669762372970581,1.1255481243133545,3.8972690105438232,16.056987762451172,3400,Wear a mask if you have flu symptoms to protect others.,Infectious disease and prevention,"[""Wear a mask if you have flu symptoms to protect others."", ""If you're experiencing flu-like symptoms, please wear a mask to safeguard others."", ""To protect others, wear a mask when you have flu symptoms."", ""Got flu symptoms? Mask up to keep others safe."", ""For the protection of others, individuals exhibiting flu symptoms are advised to wear a mask."", ""When you're sick with the flu, wear a mask to prevent spreading it.""]"
3401C.mp4,./features/pose_data/3401C.npy,126,540,1.0,0.7055575251579285,1.3541172742843628,0.8855327367782593,2.57735538482666,19.87828254699707,3401,Use a handkerchief or tissue when wiping your nose.,Infectious disease and prevention,"[""Use a handkerchief or tissue when wiping your nose."", ""Please use a handkerchief or tissue to wipe your nose."", ""Wipe your nose with a handkerchief or tissue."", ""When you need to blow your nose, use a hankie or tissue."", ""It's best to use a handkerchief or a tissue when you're wiping your nose."", ""Nose wiping: use a handkerchief or tissue.""]"
3405C.mp4,./features/pose_data/3405C.npy,360,540,1.0,0.7045543193817139,2.1958112716674805,1.115868091583252,13.12479019165039,21.10273742675781,3405,Keep livestock separate from living areas to prevent zoonotic diseases.,Infectious disease and prevention,"[""Keep livestock separate from living areas to prevent zoonotic diseases."", ""To avoid zoonotic diseases, keep your livestock away from living spaces."", ""Separating livestock from residential areas is crucial for preventing zoonotic disease transmission."", ""Keep animals and people's living spaces apart to stop zoonotic diseases."", ""Prevent zoonotic diseases by maintaining a distance between livestock and where people live."", ""Ensure livestock are not in living areas to prevent the spread of zoonotic diseases.""]"
3406E.mp4,./features/pose_data/3406E.npy,253,540,1.0,0.7170335650444031,4.828373908996582,1.200276494026184,21.31684684753418,30.74630355834961,3406,Practice good wound care to avoid bacterial infections.,Infectious disease and prevention,"[""Practice good wound care to avoid bacterial infections."", ""To prevent bacterial infections, practice good wound care."", ""Proper wound care helps avoid bacterial infections."", ""Good wound care is important for preventing bacterial infections."", ""Make sure to practice good wound care to keep bacteria away."", ""Avoid bacterial infections by taking care of your wounds properly.""]"
3408C.mp4,./features/pose_data/3408C.npy,275,540,1.0,0.6815081238746643,2.7398171424865723,1.1544643640518188,14.688117980957031,20.969593048095703,3408,Use clean running water when washing hands and dishes.,Infectious disease and prevention,"[""Use clean running water when washing hands and dishes."", ""Wash your hands and dishes with clean, running water."", ""Always use fresh, running water to clean your hands and dishes."", ""For washing hands and dishes, employ clean, running water."", ""Keep hands and dishes clean by using running water."", ""Clean running water is essential for washing hands and dishes.""]"
3413E.mp4,./features/pose_data/3413E.npy,238,540,1.0,0.6940101981163025,2.5656168460845947,1.1737275123596191,15.988322257995604,27.022016525268555,3413,Cholera is caused by contaminated water.,Infectious disease and prevention,"[""Cholera is caused by contaminated water."", ""Contaminated water is what causes cholera."", ""Cholera stems from drinking unsafe water."", ""The culprit behind cholera is polluted water."", ""Unsanitary water leads to cholera."", ""Cholera is a waterborne illness.""]"
3413C.mp4,./features/pose_data/3413C.npy,149,540,1.0,0.7135496139526367,3.355188131332397,1.4340851306915283,12.059725761413574,27.650972366333008,3413,Cholera is caused by contaminated water.,Infectious disease and prevention,"[""Cholera is caused by contaminated water."", ""Contaminated water is what causes cholera."", ""Cholera stems from drinking unsafe water."", ""The culprit behind cholera is polluted water."", ""Unsanitary water leads to cholera."", ""Cholera is a waterborne illness.""]"
3416E.mp4,./features/pose_data/3416E.npy,190,540,1.0,0.7183009386062622,2.5219454765319824,0.9725008010864258,19.094783782958984,27.155742645263672,3416,Fever and cough are symptoms of flu.,Infectious disease and prevention,"[""Fever and cough are symptoms of flu."", ""A fever and a cough can be signs that you have the flu."", ""Having a fever and coughing are symptoms of the flu."", ""Fever and cough? That's the flu."", ""The flu often presents with symptoms like fever and coughing."", ""You'll know you have the flu if you develop a fever and a cough.""]"
3420C.mp4,./features/pose_data/3420C.npy,304,540,1.0,0.7181522250175476,1.6625263690948486,0.9435548782348632,3.9231557846069336,23.08946418762207,3420,Muscle pain and headache are symptoms of malaria.,Infectious disease and prevention,"[""Muscle pain and headache are symptoms of malaria."", ""Muscle aches and headaches can be signs of malaria."", ""Malaria may present with muscle pain and a headache."", ""Symptoms of malaria include muscle pain and headache."", ""You might experience muscle aches and a headache if you have malaria."", ""Malaria's common symptoms are muscle pain and headaches.""]"
3423E.mp4,./features/pose_data/3423E.npy,148,540,1.0,0.7122193574905396,3.5667548179626465,1.4960646629333496,17.88382339477539,20.52959442138672,3423,Wear a face mask to prevent the spread of disease.,Infectious disease and prevention,"[""Wear a face mask to prevent the spread of disease."", ""Please wear a face mask to stop the spread of illness."", ""Mask up to prevent disease transmission."", ""To stop the spread of sickness, wear a face covering."", ""Wearing a face mask is recommended to prevent the transmission of diseases."", ""Put on a mask to help prevent diseases from spreading.""]"
