video_file,feature_path,num_frames,frame_feature_dim,detection_ratio,mean_visibility,motion_mean,motion_p50,motion_p95,motion_max,sentence_id,sentence,category,text_variations
1174B.mp4,./features/pose_data/1174B.npy,231,540,1.0,0.7332072854042053,1.6233757734298706,1.0698660612106323,3.5737643241882324,23.383316040039062,1174,Apply this gel before bedtime for best results.,Prescriptions,"[""Apply this gel before bedtime for best results."", ""For optimal results, apply this gel prior to sleeping."", ""Use this gel before you go to bed to get the best outcome."", ""Apply gel before bed. Best results."", ""To ensure you get the most out of it, put this gel on before you sleep."", ""Best results are achieved by applying this gel before bedtime.""]"
1181B.mp4,./features/pose_data/1181B.npy,154,540,1.0,0.713772177696228,2.431222915649414,1.075181484222412,16.65247917175293,28.00078392028809,1181,Take this one hour before bedtime.,Prescriptions,"[""Take this one hour before bedtime."", ""You should take this an hour before you go to sleep."", ""Take it one hour prior to bedtime."", ""Just take this an hour before bed."", ""Administer this dose one hour before retiring for the night."", ""An hour before sleep, take this.""]"
1192D.mp4,./features/pose_data/1192D.npy,210,540,1.0,0.7210549712181091,1.9644789695739744,1.0664633512496948,4.157809257507324,23.91712188720703,1192,"Store this in a cool place, away from direct sunlight.",Prescriptions,"[""Store this in a cool place, away from direct sunlight."", ""Keep it somewhere cool and out of the sun."", ""Store it in a cool location, shielded from direct sunlight."", ""Put this somewhere cool, away from direct sunlight."", ""This should be stored in a cool, shaded spot."", ""Store in a cool area, avoiding direct sunlight.""]"
1193E.mp4,./features/pose_data/1193E.npy,272,540,1.0,0.7330585718154907,4.182697772979736,1.3599125146865845,21.20600128173828,28.70561981201172,1193,"This medicine might make you sleepy, so avoid driving.",Prescriptions,"[""This medicine might make you sleepy, so avoid driving."", ""This medication could cause drowsiness, so please refrain from driving."", ""You might feel sleepy after taking this medicine, so don't drive."", ""Driving is not recommended while taking this medication as it may induce sleepiness."", ""Be aware that this medicine can make you drowsy, so it's best to avoid driving."", ""Sleepiness is a possible side effect of this medicine; therefore, do not operate a vehicle.""]"
1196E.mp4,./features/pose_data/1196E.npy,319,540,1.0,0.714972972869873,4.5558061599731445,1.4802919626235962,24.066797256469727,33.24916076660156,1196,Call me if your symptoms do not improve within a week.,Prescriptions,"[""Call me if your symptoms do not improve within a week."", ""Please contact me if your symptoms don't get better in seven days."", ""Get in touch if you're not feeling better after a week."", ""If your symptoms persist for a week, give me a call."", ""Don't hesitate to call if your symptoms don't see improvement within a week's time."", ""Call me if you're still unwell after a week.""]"
1197B.mp4,./features/pose_data/1197B.npy,279,540,1.0,0.7470653057098389,1.2607598304748535,0.8944318890571594,2.468531370162964,22.098175048828125,1197,Keep this away from direct sunlight and moisture.,Prescriptions,"[""Keep this away from direct sunlight and moisture."", ""Please store this out of direct sunlight and away from moisture."", ""Avoid direct sun and damp conditions for this item."", ""Keep it out of sunlight and moisture."", ""This should be kept away from direct sunlight and also moisture."", ""Protect this from direct sunlight and any moisture.""]"
1199B.mp4,./features/pose_data/1199B.npy,227,540,1.0,0.743219792842865,2.714263200759888,0.9867847561836244,20.15902709960937,24.797780990600582,1199,Avoid sugary drinks while taking this medicine.,Prescriptions,"[""Avoid sugary drinks while taking this medicine."", ""Please refrain from consuming sugary beverages when you take this medication."", ""Don't drink anything with sugar while on this medicine."", ""When taking this medicine, avoid sugary drinks."", ""It's best to avoid sweet drinks while you're on this medication."", ""Skip the sugary drinks with your medicine.""]"
1204E.mp4,./features/pose_data/1204E.npy,253,540,1.0,0.7336761355400085,3.324815511703491,1.3354458808898926,18.20279884338379,32.86444091796875,1204,The patient is experiencing chest pain; we need to act quickly.,Medical emergencies,"[""The patient is experiencing chest pain; we need to act quickly."", ""The patient has chest pain and requires immediate action."", ""We've got a patient with chest pain \u2013 we need to move fast."", ""Chest pain in the patient; urgent intervention is necessary."", ""The patient is having chest pains, so quick action is essential."", ""Need to act fast, the patient's got chest pain.""]"
1207B.mp4,./features/pose_data/1207B.npy,166,540,1.0,0.7493553757667542,2.098774671554565,0.9531234502792358,12.026598930358888,27.3083610534668,1207,Is there any difficulty breathing?,Medical emergencies,"[""Is there any difficulty breathing?"", ""Are you having trouble breathing?"", ""Is breathing difficult for you?"", ""Any breathing problems?"", ""Are you experiencing any shortness of breath?"", ""Is breathing a challenge for you right now?""]"
1209E.mp4,./features/pose_data/1209E.npy,411,540,1.0,0.7300994396209717,3.4258391857147217,1.2622811794281006,21.740535736083984,31.91379165649414,1209,Administer CPR if the patient is unresponsive and not breathing.,Medical emergencies,"[""Administer CPR if the patient is unresponsive and not breathing."", ""If the patient doesn't respond or breathe, start CPR."", ""In case of unresponsiveness and no breathing, administer cardiopulmonary resuscitation."", ""Provide CPR to the patient if they are unresponsive and not breathing."", ""Begin CPR if the patient is unresponsive and not breathing."", ""CPR should be administered when the patient is unresponsive and not breathing.""]"
1219B.mp4,./features/pose_data/1219B.npy,571,540,1.0,0.7458508014678955,1.6931302547454834,0.9171425104141236,2.936528205871582,31.636398315429688,1219,The patient has lost consciousness; we need to assess their airway.,Medical emergencies,"[""The patient has lost consciousness; we need to assess their airway."", ""The patient's unconscious, and we need to check their airway."", ""We must assess the patient's airway because they've lost consciousness."", ""Consciousness lost. Airway assessment is necessary for the patient."", ""The patient is out cold; let's check their airway."", ""Following loss of consciousness, we need to evaluate the patient's airway.""]"
1223D.mp4,./features/pose_data/1223D.npy,264,540,1.0,0.715065598487854,1.6899067163467407,1.2594082355499268,2.747042417526245,20.79742813110352,1223,The patient is vomiting blood; prepare for immediate intervention.,Medical emergencies,"[""The patient is vomiting blood; prepare for immediate intervention."", ""The patient is hemorrhaging; we need to act now."", ""Vomiting blood, the patient requires immediate attention."", ""Blood in vomit. Prepare for urgent medical action."", ""The patient is experiencing hematemesis; immediate intervention is necessary."", ""We've got a patient vomiting blood. Get ready to intervene, stat.""]"
1224B.mp4,./features/pose_data/1224B.npy,476,540,1.0,0.7439626455307007,2.248942375183105,0.99799907207489,15.294770240783691,32.7623405456543,1224,We need to control the patient's bleeding before moving the patient.,Medical emergencies,"[""We need to control the patient's bleeding before moving the patient."", ""We must first stop the patient's bleeding before relocating them."", ""Before we move the patient, their bleeding needs to be managed."", ""Control of the patient's bleeding is a priority prior to movement."", ""Let's get the bleeding under control before we move the patient."", ""The patient's bleeding must be stabilized before repositioning.""]"
1224D.mp4,./features/pose_data/1224D.npy,223,540,1.0,0.6983419060707092,2.761847496032715,1.4046415090560913,15.362608909606934,30.029016494750977,1224,We need to control the patient's bleeding before moving the patient.,Medical emergencies,"[""We need to control the patient's bleeding before moving the patient."", ""We must first stop the patient's bleeding before relocating them."", ""Before we move the patient, their bleeding needs to be managed."", ""Control of the patient's bleeding is a priority prior to movement."", ""Let's get the bleeding under control before we move the patient."", ""The patient's bleeding must be stabilized before repositioning.""]"
1227D.mp4,./features/pose_data/1227D.npy,228,540,1.0,0.701259434223175,2.346045732498169,1.314509630203247,12.962023735046388,23.545785903930664,1227,The patient's heart rate is dangerously low.,Medical emergencies,"[""The patient's heart rate is dangerously low."", ""The patient's heart rate is critically low."", ""The patient's pulse is alarmingly weak."", ""We have a dangerously low heart rate on the patient."", ""Patient's heart rate: dangerously low."", ""The patient's heart rate has dropped to a dangerous level.""]"
1229E.mp4,./features/pose_data/1229E.npy,278,540,1.0,0.731530487537384,4.970653533935547,1.0297462940216064,24.63054656982422,34.04297637939453,1229,Move the injured person only if it's necessary.,Medical emergencies,"[""Move the injured person only if it's necessary."", ""Only move the injured individual if absolutely required."", ""If it's essential, then relocate the injured person."", ""Relocate the injured person solely when it's a must."", ""It's only necessary to move the injured individual if circumstances demand it."", ""Move the injured person if and only if it's needed.""]"
1230E.mp4,./features/pose_data/1230E.npy,246,540,1.0,0.7307138442993164,2.902106046676636,1.0401151180267334,21.44451141357422,32.422245025634766,1230,Perform CPR if there is no pulse.,Medical emergencies,"[""Perform CPR if there is no pulse."", ""Administer CPR if no pulse is detected."", ""If there's no pulse, start CPR immediately."", ""No pulse? Begin CPR."", ""In the absence of a pulse, perform CPR."", ""CPR should be administered if a pulse cannot be found.""]"
1231B.mp4,./features/pose_data/1231B.npy,164,540,1.0,0.7366108894348145,2.005685329437256,1.1129508018493652,4.542172431945801,23.26279067993164,1231,The patient has a broken bone.,Medical emergencies,"[""The patient has a broken bone."", ""The patient has sustained a fracture."", ""The patient's bone is broken."", ""There's a broken bone with the patient."", ""The patient is suffering from a broken bone."", ""Broken bone in the patient.""]"
1245B.mp4,./features/pose_data/1245B.npy,170,540,1.0,0.737867534160614,3.3123459815979004,1.2204809188842771,20.265844345092773,34.150760650634766,1245,Stay with the person and monitor their condition.,Medical emergencies,"[""Stay with the person and monitor their condition."", ""Please remain with the individual and observe their medical status."", ""Stay put and keep an eye on how they're doing."", ""Don't leave them; watch their condition."", ""Accompany them and monitor their well-being."", ""Stay by their side and monitor their status.""]"
1250B.mp4,./features/pose_data/1250B.npy,267,540,1.0,0.7432160377502441,2.094256639480591,1.0298302173614502,12.307300567626951,24.01603889465332,1250,Avoid touching a burn with bare hands.,Medical emergencies,"[""Avoid touching a burn with bare hands."", ""Do not touch a burn with your bare hands."", ""Refrain from touching burns without gloves."", ""Keep bare hands away from burns."", ""It's important not to touch a burn with unprotected hands."", ""Don't touch burns directly.""]"
1251B.mp4,./features/pose_data/1251B.npy,475,540,1.0,0.7375869154930115,2.5579445362091064,0.9498139023780824,19.19502258300781,28.909326553344727,1251,Remove tight jewelry from a swollen area.,Medical emergencies,"[""Remove tight jewelry from a swollen area."", ""Please take off any jewelry that's too tight on the swollen part."", ""Gently remove any constricting jewelry from the affected swollen area."", ""Loosen and remove tight jewelry from the swollen region."", ""For the swollen area, remove any tight jewelry."", ""Take off tight jewelry from the swollen area.""]"
1254D.mp4,./features/pose_data/1254D.npy,187,540,1.0,0.7127339839935303,2.310876607894897,1.0381650924682615,14.94724178314209,30.169208526611328,1254,The patient is having a severe panic attack; help them calm down.,Medical emergencies,"[""The patient is having a severe panic attack; help them calm down."", ""The patient is experiencing a severe panic attack. Please assist them in calming down."", ""We need to help this patient calm down. They're having a severe panic attack."", ""Severe panic attack in progress. Please provide assistance to calm the patient."", ""Patient is in severe distress and having a panic attack. Let's try to help them relax."", ""Help the patient! They're having a bad panic attack and need to be calmed.""]"
1254B.mp4,./features/pose_data/1254B.npy,367,540,1.0,0.7423045635223389,2.743223190307617,1.0537493228912354,19.873647689819336,32.74022674560547,1254,The patient is having a severe panic attack; help them calm down.,Medical emergencies,"[""The patient is having a severe panic attack; help them calm down."", ""The patient is experiencing a severe panic attack. Please assist them in calming down."", ""We need to help this patient calm down. They're having a severe panic attack."", ""Severe panic attack in progress. Please provide assistance to calm the patient."", ""Patient is in severe distress and having a panic attack. Let's try to help them relax."", ""Help the patient! They're having a bad panic attack and need to be calmed.""]"
1255D.mp4,./features/pose_data/1255D.npy,234,540,1.0,0.7269074320793152,1.4901548624038696,1.0484338998794556,2.7524993419647217,24.65999794006348,1255,The patient is experiencing a severe migraine; administer pain relief.,Medical emergencies,"[""The patient is experiencing a severe migraine; administer pain relief."", ""Please provide pain relief for the patient suffering from a severe migraine."", ""The patient has a bad migraine. Give them pain medication."", ""Severe migraine. Patient needs pain relief."", ""Administer pain relief medication to the patient who is in severe pain from a migraine."", ""Migraine is severe. Pain relief needed for patient.""]"
1263D.mp4,./features/pose_data/1263D.npy,225,540,1.0,0.7229446172714233,1.866242289543152,1.030272364616394,4.849648952484131,22.28419303894043,1263,Rinse the affected eye with clean water for at least 15 minutes.,Medical emergencies,"[""Rinse the affected eye with clean water for at least 15 minutes."", ""Flush the injured eye with clean water for a minimum of 15 minutes."", ""Make sure to rinse the affected eye with clean water for at least 15 minutes."", ""Clean water should be used to rinse the affected eye for a duration of 15 minutes or more."", ""Rinse the eye for 15 minutes minimum using clean water."", ""Take at least 15 minutes to rinse the affected eye with clean water.""]"
1265D.mp4,./features/pose_data/1265D.npy,219,540,1.0,0.7016575336456299,2.738680839538574,1.3688935041427612,14.813685417175291,19.493581771850582,1265,Stay with them until medical help arrives.,Medical emergencies,"[""Stay with them until medical help arrives."", ""Remain with them until the paramedics get here."", ""Hang out with them till the ambulance shows up."", ""Stay there with them until medical assistance is available."", ""Keep them company until the doctors or nurses arrive."", ""Don't leave them until help arrives.""]"
1271E.mp4,./features/pose_data/1271E.npy,161,540,1.0,0.7353561520576477,4.435924530029297,1.1980817317962646,20.89906120300293,38.29875946044922,1271,Use an ice pack to reduce swelling.,Medical emergencies,"[""Use an ice pack to reduce swelling."", ""Apply an ice pack to minimize swelling."", ""Put an ice pack on it to bring down the swelling."", ""Ice pack for swelling reduction."", ""To lessen the swelling, use an ice pack."", ""Grab an ice pack for the swelling.""]"
1274E.mp4,./features/pose_data/1274E.npy,183,540,1.0,0.7094196081161499,2.4558751583099365,1.014469861984253,19.02572250366211,23.67140007019043,1274,Keep the wound clean and covered.,Medical emergencies,"[""Keep the wound clean and covered."", ""Make sure the wound stays clean and is covered."", ""It's important to keep the wound clean and protected."", ""Cover the wound and keep it clean."", ""Ensure the wound is kept clean and bandaged."", ""Clean and cover the wound.""]"
1276E.mp4,./features/pose_data/1276E.npy,107,540,1.0,0.7264962792396545,2.6850428581237797,1.0378222465515137,16.6961612701416,22.123798370361328,1276,Help is on the way.,Medical emergencies,"[""Help is on the way."", ""Assistance is arriving."", ""We're coming to help."", ""Help is coming."", ""Support is en route."", ""Someone's on their way to help you.""]"
1281B.mp4,./features/pose_data/1281B.npy,174,540,1.0,0.7246432900428772,1.7641113996505735,0.8682355880737305,3.2724733352661133,26.772851943969727,1281,Lift your head slowly.,Medical emergencies,"[""Lift your head slowly."", ""Please raise your head gently."", ""Slowly lift your head."", ""Can you slowly lift your head?"", ""Take your time and lift your head."", ""Gently bring your head up.""]"
1283D.mp4,./features/pose_data/1283D.npy,109,540,1.0,0.7056431770324707,2.832433223724365,1.119741916656494,16.25162124633789,22.67585182189941,1283,Squeeze my hand if you can hear me.,Medical emergencies,"[""Squeeze my hand if you can hear me."", ""Give my hand a squeeze if you can hear me."", ""If you can hear me, please squeeze my hand."", ""Can you hear me? Squeeze my hand."", ""Squeeze my hand to let me know you hear me.""]"
1284E.mp4,./features/pose_data/1284E.npy,157,540,1.0,0.677946925163269,3.226428508758545,1.0354241132736206,17.46383285522461,29.623085021972656,1284,Close your eyes and rest.,Medical emergencies,"[""Close your eyes and rest."", ""Close your eyes and take a rest."", ""Rest your eyes."", ""Please close your eyes and relax for a moment."", ""Time to close your eyes and rest."", ""Let's have a rest, close your eyes.""]"
1288B.mp4,./features/pose_data/1288B.npy,165,540,1.0,0.7458469271659851,1.9725821018218996,1.1025480031967163,3.3400919437408447,21.111452102661133,1288,Do not eat or drink right now.,Medical emergencies,"[""Do not eat or drink right now."", ""Please refrain from eating or drinking at this moment."", ""No food or beverages allowed presently."", ""Don't eat or drink now."", ""Eating and drinking are prohibited for the time being."", ""Cease eating and drinking for now.""]"
1291D.mp4,./features/pose_data/1291D.npy,103,540,1.0,0.7158929109573364,1.9039266109466555,1.1845444440841677,3.0510401725769043,23.45991325378418,1291,Hold your stomach if it hurts.,Medical emergencies,"[""Hold your stomach if it hurts."", ""If your stomach hurts, hold it."", ""You should hold your stomach if you're experiencing pain there."", ""Press on your stomach if it's hurting."", ""Got a stomach ache? Hold it."", ""In case of stomach pain, apply pressure to the area.""]"
1298D.mp4,./features/pose_data/1298D.npy,54,540,1.0,0.7116371393203735,3.295461416244507,1.2693614959716797,19.595611572265625,21.333728790283203,1298,Point to the pain.,Medical emergencies,"[""Point to the pain."", ""Please indicate where it hurts."", ""Show me where the pain is."", ""Where does it hurt?"", ""Can you show me the spot that's painful?"", ""Point to the area of discomfort.""]"
1298E.mp4,./features/pose_data/1298E.npy,108,540,1.0,0.7501172423362732,2.3713953495025635,1.4391112327575684,11.17222785949707,19.023088455200195,1298,Point to the pain.,Medical emergencies,"[""Point to the pain."", ""Please indicate where it hurts."", ""Show me where the pain is."", ""Where does it hurt?"", ""Can you show me the spot that's painful?"", ""Point to the area of discomfort.""]"
1302B.mp4,./features/pose_data/1302B.npy,123,540,1.0,0.7512497305870056,3.0081627368927,1.286168336868286,20.911096572875977,35.749874114990234,1302,"Do not panic, I am here.",Medical emergencies,"[""Do not panic, I am here."", ""Don't worry, I'm here."", ""Remain calm, I'm present."", ""Please do not be alarmed; I have arrived."", ""Stay calm, I'm here for you."", ""No need to panic, I am here.""]"
1305B.mp4,./features/pose_data/1305B.npy,216,540,1.0,0.7449967861175537,2.7977097034454346,0.9866923689842224,18.117652893066406,29.84468460083008,1305,Press on your chest if you feel tightness.,Medical emergencies,"[""Press on your chest if you feel tightness."", ""If you feel tightness, press on your chest."", ""Feel tightness? Press your chest."", ""Place pressure on your chest if you experience tightness."", ""Press your chest when you feel tight."", ""When tightness occurs, press on your chest.""]"
1306E.mp4,./features/pose_data/1306E.npy,146,540,1.0,0.7517262101173401,1.788757562637329,0.8139406442642212,2.8074827194213867,24.32304954528809,1306,Stay warm and still.,Medical emergencies,"[""Stay warm and still."", ""Please remain warm and motionless."", ""Stay put and keep warm."", ""Keep yourself warm and don't move."", ""Stay still, stay warm."", ""Ensure you are warm and remain stationary.""]"
1311B.mp4,./features/pose_data/1311B.npy,214,540,1.0,0.7104923129081726,1.553390622138977,0.8811510801315308,2.7129933834075928,22.65699577331543,1311,Lift your leg if it hurts.,Medical emergencies,"[""Lift your leg if it hurts."", ""Raise your leg if you feel pain."", ""If your leg hurts, lift it."", ""Please lift your leg if it's causing you discomfort."", ""Leg hurts? Lift it."", ""Indicate pain in your leg by raising it.""]"
1319D.mp4,./features/pose_data/1319D.npy,146,540,1.0,0.692370593547821,2.1083734035491943,1.124955415725708,4.72090482711792,32.5565299987793,1319,Rub your stomach if it feels bad.,Medical emergencies,"[""Rub your stomach if it feels bad."", ""If your stomach hurts, rub it."", ""Please rub your stomach if you experience discomfort."", ""Got a tummy ache? Rub it."", ""In case of stomach pain, a gentle rub is advised."", ""Rub your belly if it feels off.""]"
1322D.mp4,./features/pose_data/1322D.npy,179,540,1.0,0.7176194787025452,2.2093193531036377,1.102669358253479,5.378477096557617,24.31001281738281,1322,Tap your chest if it is hard to breathe.,Medical emergencies,"[""Tap your chest if it is hard to breathe."", ""If breathing is difficult, please tap your chest."", ""Tap your chest when you're having trouble breathing."", ""Can you tap your chest if breathing feels hard?"", ""Tap your chest if you find it hard to breathe."", ""Difficulty breathing? Tap your chest.""]"
1323B.mp4,./features/pose_data/1323B.npy,139,540,1.0,0.7043113708496094,2.8552839756011963,1.2813758850097656,17.62343406677246,22.907032012939453,1323,Point up if you need help now.,Medical emergencies,"[""Point up if you need help now."", ""If you require assistance at this moment, please point upwards."", ""Need help? Point up."", ""Please signal upwards if you need help right now."", ""Point up if you need immediate assistance."", ""Show me by pointing up if you need help.""]"
1326B.mp4,./features/pose_data/1326B.npy,177,540,1.0,0.7163559198379517,1.4233204126358032,0.9585777521133424,2.896433115005493,17.539478302001953,1326,Raise one finger if you are in pain.,Medical emergencies,"[""Raise one finger if you are in pain."", ""If you're experiencing pain, please raise one finger."", ""Hold up one finger to indicate you are in pain."", ""Pain? Raise a finger."", ""For those in pain, kindly raise one finger."", ""Show me one finger if you feel pain.""]"
1328E.mp4,./features/pose_data/1328E.npy,222,540,1.0,0.7436751127243042,2.860870361328125,0.9556275606155396,19.684282302856445,24.9335880279541,1328,"If you feel dizzy, close your eyes for a moment.",Medical emergencies,"[""If you feel dizzy, close your eyes for a moment."", ""Should you experience dizziness, please close your eyes briefly."", ""Feeling lightheaded? Try closing your eyes for a bit."", ""If you're dizzy, just close your eyes for a moment."", ""In case of dizziness, a brief eye closure is recommended."", ""When you feel dizzy, close your eyes temporarily.""]"
1329B.mp4,./features/pose_data/1329B.npy,203,540,1.0,0.7150440216064453,1.3152003288269043,1.0028076171875,2.0728931427001958,23.12349510192871,1329,Hold your stomach if you feel sick.,Medical emergencies,"[""Hold your stomach if you feel sick."", ""If you're feeling unwell, hold your stomach."", ""You can hold your stomach if you feel sick."", ""Feeling sick? Grab your stomach."", ""To alleviate nausea, press on your abdomen."", ""If nausea strikes, place a hand on your stomach.""]"
1331B.mp4,./features/pose_data/1331B.npy,182,540,1.0,0.6996216773986816,2.215252161026001,1.43580961227417,3.807894706726074,23.5540714263916,1331,Tap my hand if you need help.,Medical emergencies,"[""Tap my hand if you need help."", ""Tap my hand to signal you need help."", ""If you need assistance, just tap my hand."", ""Need help? Tap my hand."", ""Please tap my hand when you require assistance."", ""A tap on my hand means you need help.""]"
1331D.mp4,./features/pose_data/1331D.npy,148,540,1.0,0.7154158353805542,1.1832443475723269,0.9644299149513244,2.2986361980438232,5.993662357330322,1331,Tap my hand if you need help.,Medical emergencies,"[""Tap my hand if you need help."", ""Tap my hand to signal you need help."", ""If you need assistance, just tap my hand."", ""Need help? Tap my hand."", ""Please tap my hand when you require assistance."", ""A tap on my hand means you need help.""]"
